{
  "$schema": "http://json-schema.org/draft-07/schema#",
  "title": "RobotMission",
  "description": "Validated mission plan emitted by LLM and executed by Nav2",
  "type": "object",
  "required": ["mission_name", "waypoints"],

  "properties": {

    "mission_name": {
      "type": "string",
      "minLength": 1,
      "maxLength": 100,
      "description": "Human-readable mission label, e.g. 'Patrol perimeter loop'"
    },

    "description": {
      "type": "string",
      "maxLength": 500,
      "description": "Optional free-text summary of mission intent"
    },

    "frame_id": {
      "type": "string",
      "enum": ["map"],
      "default": "map",
      "description": "Coordinate frame — only 'map' is supported"
    },

    "loop_count": {
      "type": "integer",
      "minimum": 1,
      "maximum": 10,
      "default": 1,
      "description": "How many times to repeat the full waypoint sequence"
    },

    "return_to_start": {
      "type": "boolean",
      "default": false,
      "description": "If true, append the first waypoint to the end of each loop"
    },

    "max_speed": {
      "type": "number",
      "minimum": 0.05,
      "maximum": 0.5,
      "default": 0.3,
      "description": "Linear speed cap in m/s — enforced by executor, not Nav2 directly"
    },

    "stop_on_failure": {
      "type": "boolean",
      "default": false,
      "description": "Abort entire mission if any single waypoint fails"
    },

    "waypoints": {
      "type": "array",
      "minItems": 1,
      "maxItems": 20,
      "description": "Ordered list of poses the robot must visit",
      "items": {
        "type": "object",
        "required": ["x", "y"],
        "properties": {

          "x": {
            "type": "number",
            "description": "X coordinate in the map frame (metres)"
          },
          "y": {
            "type": "number",
            "description": "Y coordinate in the map frame (metres)"
          },
          "yaw": {
            "type": "number",
            "minimum": -3.14159,
            "maximum":  3.14159,
            "default": 0.0,
            "description": "Heading in radians at this waypoint"
          },

          "label": {
            "type": "string",
            "description": "Optional semantic name, e.g. 'north_corner', 'loading_bay'"
          },

          "tasks": {
            "type": "array",
            "description": "Optional actions to execute upon arriving at this waypoint",
            "items": {
              "type": "object",
              "required": ["action"],
              "properties": {

                "action": {
                  "type": "string",
                  "enum": ["wait", "spin"],
                  "description": "Known Nav2 behaviour — only these two are allowed"
                },

                "duration": {
                  "type": "number",
                  "minimum": 0.0,
                  "maximum": 60.0,
                  "description": "Seconds to wait (used by 'wait' action)"
                },

                "angle": {
                  "type": "number",
                  "minimum": -6.28318,
                  "maximum":  6.28318,
                  "description": "Radians to spin (used by 'spin' action)"
                }
              },
              "additionalProperties": false
            }
          }
        },
        "additionalProperties": false
      }
    }
  },
  "additionalProperties": false
}
